[
  {
    "id": "zip-21201",
    "version": 1,
    "kind": "real_reference",
    "operation": "resolve_zip",
    "input": {
      "zip": "21201",
      "gazetteer": "tests/fixtures/raw/census.zip"
    },
    "expected": {
      "zip": "21201",
      "latitude_deg": 39.294961,
      "longitude_deg": -76.622341,
      "confirmed": false
    },
    "requirements": [
      "R002"
    ],
    "stories": [
      "US-01"
    ],
    "oracle": "Direct exact GEOID row lookup in archived Census 2025, not application output."
  },
  {
    "id": "zip-00601",
    "version": 1,
    "kind": "real_reference",
    "operation": "resolve_zip",
    "input": {
      "zip": "00601",
      "gazetteer": "tests/fixtures/raw/census.zip"
    },
    "expected": {
      "zip": "00601",
      "latitude_deg": 18.180555,
      "longitude_deg": -66.749961,
      "confirmed": false
    },
    "requirements": [
      "R002"
    ],
    "stories": [
      "US-01"
    ],
    "oracle": "Direct exact GEOID row lookup in archived Census 2025, not application output."
  },
  {
    "id": "zip-missing",
    "version": 1,
    "kind": "synthetic",
    "operation": "resolve_zip",
    "input": {
      "zip": "00000",
      "gazetteer": "tests/fixtures/raw/census.zip"
    },
    "expected": {
      "status": "unavailable",
      "fallback": [
        "gps",
        "manual"
      ]
    },
    "requirements": [
      "R002"
    ],
    "stories": [
      "US-01"
    ],
    "oracle": "Normative decision table in spec/rules.md; hand-specified boundary outcome."
  },
  {
    "id": "zip-numeric",
    "version": 1,
    "kind": "synthetic",
    "operation": "resolve_zip",
    "input": {
      "zip": 601
    },
    "expected": {
      "error": "INVALID_INPUT"
    },
    "requirements": [
      "R002"
    ],
    "stories": [
      "US-01"
    ],
    "oracle": "Normative decision table in spec/rules.md; hand-specified boundary outcome."
  },
  {
    "id": "location-change",
    "version": 1,
    "kind": "synthetic",
    "operation": "location_change",
    "input": {
      "old_confirmed": true,
      "old_revision": 1,
      "new_point": [
        39.3,
        -76.7
      ]
    },
    "expected": {
      "confirmed": false,
      "revision": 2,
      "invalidate_assessment": true
    },
    "requirements": [
      "R002",
      "R011"
    ],
    "stories": [
      "US-01"
    ],
    "oracle": "Normative decision table in spec/rules.md; hand-specified boundary outcome."
  },
  {
    "id": "rollover",
    "version": 1,
    "kind": "synthetic",
    "operation": "local_time",
    "input": {
      "utc": "2026-10-14T00:30:00Z",
      "timezone": "America/New_York",
      "device_timezone": "America/Los_Angeles"
    },
    "expected": {
      "local": "2026-10-13T20:30:00-04:00",
      "abbreviation": "EDT",
      "fold": 0
    },
    "requirements": [
      "R008"
    ],
    "stories": [
      "US-02",
      "US-03"
    ],
    "oracle": "Python zoneinfo/IANA conversion, frozen UTC vectors; no app code."
  },
  {
    "id": "dst-fold-edt",
    "version": 1,
    "kind": "synthetic",
    "operation": "local_time",
    "input": {
      "utc": "2026-11-01T05:30:00Z",
      "timezone": "America/New_York",
      "device_timezone": "America/Los_Angeles"
    },
    "expected": {
      "local": "2026-11-01T01:30:00-04:00",
      "abbreviation": "EDT",
      "fold": 0
    },
    "requirements": [
      "R008"
    ],
    "stories": [
      "US-02",
      "US-03"
    ],
    "oracle": "Python zoneinfo/IANA conversion, frozen UTC vectors; no app code."
  },
  {
    "id": "dst-fold-est",
    "version": 1,
    "kind": "synthetic",
    "operation": "local_time",
    "input": {
      "utc": "2026-11-01T06:30:00Z",
      "timezone": "America/New_York",
      "device_timezone": "America/Los_Angeles"
    },
    "expected": {
      "local": "2026-11-01T01:30:00-05:00",
      "abbreviation": "EST",
      "fold": 1
    },
    "requirements": [
      "R008"
    ],
    "stories": [
      "US-02",
      "US-03"
    ],
    "oracle": "Python zoneinfo/IANA conversion, frozen UTC vectors; no app code."
  },
  {
    "id": "dst-spring-before",
    "version": 1,
    "kind": "synthetic",
    "operation": "local_time",
    "input": {
      "utc": "2026-03-08T06:59:00Z",
      "timezone": "America/New_York",
      "device_timezone": "America/Los_Angeles"
    },
    "expected": {
      "local": "2026-03-08T01:59:00-05:00",
      "abbreviation": "EST",
      "fold": 0
    },
    "requirements": [
      "R008"
    ],
    "stories": [
      "US-02",
      "US-03"
    ],
    "oracle": "Python zoneinfo/IANA conversion, frozen UTC vectors; no app code."
  },
  {
    "id": "dst-spring-after",
    "version": 1,
    "kind": "synthetic",
    "operation": "local_time",
    "input": {
      "utc": "2026-03-08T07:00:00Z",
      "timezone": "America/New_York",
      "device_timezone": "America/Los_Angeles"
    },
    "expected": {
      "local": "2026-03-08T03:00:00-04:00",
      "abbreviation": "EDT",
      "fold": 0
    },
    "requirements": [
      "R008"
    ],
    "stories": [
      "US-02",
      "US-03"
    ],
    "oracle": "Python zoneinfo/IANA conversion, frozen UTC vectors; no app code."
  },
  {
    "id": "dst-nonexistent",
    "version": 1,
    "kind": "synthetic",
    "operation": "parse_local",
    "input": {
      "local": "2026-03-08T02:30:00",
      "timezone": "America/New_York",
      "offset": null
    },
    "expected": {
      "error": "INVALID_INPUT"
    },
    "requirements": [
      "R008"
    ],
    "stories": [
      "US-03"
    ],
    "oracle": "Normative decision table in spec/rules.md; hand-specified boundary outcome."
  },
  {
    "id": "dst-ambiguous",
    "version": 1,
    "kind": "synthetic",
    "operation": "parse_local",
    "input": {
      "local": "2026-11-01T01:30:00",
      "timezone": "America/New_York",
      "offset": null
    },
    "expected": {
      "error": "INVALID_INPUT"
    },
    "requirements": [
      "R008"
    ],
    "stories": [
      "US-03"
    ],
    "oracle": "Normative decision table in spec/rules.md; hand-specified boundary outcome."
  },
  {
    "id": "cape-md-pad",
    "version": 1,
    "kind": "synthetic",
    "operation": "geometry",
    "input": {
      "observer_lat_lon_alt_m": [
        39.294961,
        -76.622341,
        0
      ],
      "target_lat_lon_alt_m": [
        28.608,
        -80.604,
        0
      ]
    },
    "expected": {
      "azimuth_deg": 198.39567264403505,
      "elevation_deg": -5.589525125741493,
      "range_m": 1238900.0297777015
    },
    "requirements": [
      "R006",
      "R018",
      "R019"
    ],
    "stories": [
      "US-07"
    ],
    "oracle": "Independent PROJ topocentric pipeline via pyproj 3.8.0; WGS84. Synthetic target; no claimed flown route.",
    "tolerance": {
      "azimuth_deg": 0.1,
      "elevation_deg": 0.1,
      "range_m": 1
    }
  },
  {
    "id": "cape-md-high",
    "version": 1,
    "kind": "synthetic",
    "operation": "geometry",
    "input": {
      "observer_lat_lon_alt_m": [
        39.294961,
        -76.622341,
        0
      ],
      "target_lat_lon_alt_m": [
        33,
        -76,
        200000
      ]
    },
    "expected": {
      "azimuth_deg": 175.23012500510006,
      "elevation_deg": 12.52295893148025,
      "range_m": 738898.1492220978
    },
    "requirements": [
      "R006",
      "R018",
      "R019"
    ],
    "stories": [
      "US-07"
    ],
    "oracle": "Independent PROJ topocentric pipeline via pyproj 3.8.0; WGS84. Synthetic target; no claimed flown route.",
    "tolerance": {
      "azimuth_deg": 0.1,
      "elevation_deg": 0.1,
      "range_m": 1
    }
  },
  {
    "id": "near-pad",
    "version": 1,
    "kind": "synthetic",
    "operation": "geometry",
    "input": {
      "observer_lat_lon_alt_m": [
        28.608,
        -80.604,
        0
      ],
      "target_lat_lon_alt_m": [
        28.61,
        -80.6,
        10000
      ]
    },
    "expected": {
      "azimuth_deg": 60.46326118874677,
      "elevation_deg": 87.42142208859929,
      "range_m": 10010.119758944926
    },
    "requirements": [
      "R006",
      "R018",
      "R019"
    ],
    "stories": [
      "US-07"
    ],
    "oracle": "Independent PROJ topocentric pipeline via pyproj 3.8.0; WGS84. Synthetic target; no claimed flown route.",
    "tolerance": {
      "azimuth_deg": 0.1,
      "elevation_deg": 0.1,
      "range_m": 1
    }
  },
  {
    "id": "equator-east",
    "version": 1,
    "kind": "synthetic",
    "operation": "geometry",
    "input": {
      "observer_lat_lon_alt_m": [
        0,
        0,
        0
      ],
      "target_lat_lon_alt_m": [
        0,
        1,
        100000
      ]
    },
    "expected": {
      "azimuth_deg": 90.0,
      "elevation_deg": 41.21078737283902,
      "range_m": 150286.38892572914
    },
    "requirements": [
      "R006",
      "R018",
      "R019"
    ],
    "stories": [
      "US-07"
    ],
    "oracle": "Independent PROJ topocentric pipeline via pyproj 3.8.0; WGS84. Synthetic target; no claimed flown route.",
    "tolerance": {
      "azimuth_deg": 0.1,
      "elevation_deg": 0.1,
      "range_m": 1
    }
  },
  {
    "id": "sunrise-baltimore",
    "version": 1,
    "kind": "real_reference",
    "operation": "solar_events",
    "input": {
      "latitude_deg": 39.294961,
      "longitude_deg": -76.622341,
      "altitude_m": 0,
      "local_date": "2026-10-13",
      "timezone": "America/New_York",
      "sunrise_center_deg": -0.833
    },
    "expected": {
      "sunrise": "2026-10-13T11:14:00Z",